"October 17, 2024",2:54:56 PM,CXp_Guest,,"It wouldn't let me type my address, 1800 Davis dr W. It would auto full with the incorrect address. The euro around was to type the postal code, select the correct street.  Then use the cursor to move to the front and type the street number. Someone who is not tech savvy would never have figured it out.  It's 2024 and as a country we can't even figure out an online form. Bravo. I hope this gets corrected. Please call me and I can show you. This was done on mobile. 

God speed ??"
"October 15, 2024",7:52:10 PM,CXp_Guest,,not sure its really easy
"October 14, 2024",11:09:50 PM,CXp_Guest,,"I experienced a lot of glitching while using this application and had to re-enter the same information, multiple times. It was a bit frustrating to be honest."
"October 13, 2024",3:48:11 PM,CXp_Guest,,Service was down and I was not notified until after I completed an entire form. Very disappointed and frustrated.
"October 11, 2024",3:46:15 PM,CXp_Guest,,I do not think there is any improvements needed. This service was very easy to use and fast.
"October 11, 2024",11:40:00 PM,CXp_Guest,,its already perfect
"October 9, 2024",1:56:41 PM,CXp_Guest,,"Completed everything to then submit and be told the service is temporary unavailable.
If having tech problems stat that before spending time completing forms!"
"October 9, 2024",9:54:45 PM,CXp_Guest,,I keep getting an error message when i try to renew my child's Health Card Online
"October 9, 2024",12:17:28 PM,CXp_Guest,,"I was confused when I had to input the 9 digit code from the back of my child's card as the text says

""9 characters on the back of your card"". It should read ""9 characters on the back of your child's card"".

Thank you."
"October 9, 2024",2:10:28 PM,CXp_Guest,,"No need, it's good."
"October 8, 2024",10:42:42 AM,CXp_Guest,,It says I am trying to access the services while I'm not in Ontario which is incorrect. I am at my residence in Ontario and can't access the renewal services
"October 8, 2024",1:42:54 PM,CXp_Guest,,"I've tried accessing the health card renewal for my child from my desktop twice (using different browsers) and my phone and all 3 times it says ""You cannot complete your child's online renewal application at this time because you are currently accessing the service from outside Ontario"" but I am at my home in Guelph ON"
"October 6, 2024",3:40:15 PM,CXp_Guest,,The system for entering the mailing address was terrible
"October 5, 2024",2:49:58 PM,CXp_Account,,I'm really impressed - especially for a government service :)
"October 4, 2024",9:35:59 AM,CXp_Guest,,where is the application for child renewal?  i clicked on the option and it didn't show an application.
"October 2, 2024",7:22:07 PM,CXp_Guest,,Very Good and simple to use Service - Thanks
"September 30, 2024",2:40:29 PM,CXp_Guest,,I am beyond happy with the fact we no longer need to visit Service Ontario locations to get these things done. I have never in my life experienced such mistreatment from 90% of  the people I have had to deal with at those offices.
"September 30, 2024",9:49:50 AM,CXp_Guest,,n/a very simple to use
"September 30, 2024",10:36:50 PM,CXp_Guest,,nothing to improve
"September 30, 2024",6:05:02 PM,CXp_Guest,,The page to renew the health card should have a button to renew a child's health card at the top of the page so you know that is you scroll all the way down you would have found it
"September 26, 2024",10:18:13 AM,CXp_Guest,,Give out reminders of when it is time to renew Health Cards. I didn't realize his Health Card expired at 9 years old... Maybe more awareness would help others.
"September 23, 2024",11:05:01 AM,CXp_Guest,,Address look up acts weird and won't let delete a mistake once looked up. Had to select all and cut out wrong address to be able to add correct address.
"September 20, 2024",12:53:57 PM,CXp_Guest,,Have an email sent when the card is shipped for notification purposes
"September 19, 2024",9:37:48 PM,CXp_Guest,,"It would be nice if you would allow for French accents or at least update your error message. When I entered the accent aigue ""é"" on my child's name I got an error saying something like the name was incorrect. If you can't accept accents, you could at least say ""please enter your name without any accents or special characters"". Otherwise, very easy to use and quick. Merci! :)"
"September 18, 2024",1:47:04 PM,CXp_Guest,,I am very impressed with how easy this process was. Your online system is excellent.
"September 11, 2024",9:16:16 AM,CXp_Guest,,"Everything was quick, efficient and had all of the information needed. There are some typos though like at the end to confirm information is correct."
"September 9, 2024",1:47:16 PM,CXp_Guest,,Excellent! So east and fast to renew my daughters health card!  Thank you
"September 5, 2024",5:44:03 AM,CXp_Guest,,It was difficult to locate birth certificate number as the official document has it displayed differently. But overall quick and easy to use service.
"September 5, 2024",6:16:18 PM,CXp_Guest,,Its perfect.
"August 30, 2024",11:57:56 AM,CXp_Guest,,You are doing a great job. Keep it up.
"August 29, 2024",8:06:04 PM,CXp_Guest,,i think online renewal is perfect 10/10 wouldn't change a thing
"August 26, 2024",11:36:25 AM,CXp_Guest,,have your system running properly so ppl can complete services online
"August 19, 2024",12:30:41 AM,CXp_Guest,,Very easy and convenient
"August 16, 2024",8:42:31 PM,CXp_Guest,,"Easy to understand and follow. Was able to renew child OHip without going to in person transaction. 
Very satisfied with the system."
"August 12, 2024",12:16:08 PM,CXp_Guest,,Lucky to have a photo of birth certificate with me...renewing from cottage
"August 9, 2024",7:45:37 PM,CXp_Guest,,At the end I put my email in to receive the receipt and clicked the button but nothing changed on the screen so was not clear if it sent. I clicked it a couple times and ended up with multiple emails. Also not clear on if childs current health card which is shortly expiring will still be accepted as we wait 4-6 weeks. Is there an automatic extension? Will there be issues at clinics or with doctors? Clarity is needed and if an extension is not done then a change in process is needed to ensure continued health coverage.
"August 9, 2024",2:31:21 PM,CXp_Guest,,"It's fantastic that you can renew health cards online!  However, I had several issues when trying to enter our mailing address. The first time I tried, the system did not automatically complete my address. I typed my whole address in and hit ""continue"" and then discovered on the confirmation page that my address had been confirmed in an entirely different city. So I was unable to complete my form.

On the second try - when I typed our street number in Ottawa, the system automatically confirmed an address in Killarney, Ontario and would not let me change the town name or postal code.  I was about to give up entirely when my husband typed in Ottawa first, followed by our street address, which sorted things out.  But there was nothing to suggest that this was how it needed to be completed, which was frustrating."
"August 6, 2024",8:29:37 PM,CXp_Guest,,"The mailing address auto-fill was a bit of a pain, maybe because I was using a phone. I figured it out after a few tries but I think leaving it to be a manual would make it easier. Thanks."
"August 5, 2024",5:50:15 PM,CXp_Guest,,Thank you for making it so easy! Thank you for all the work that you do!
"August 4, 2024",2:52:26 PM,CXp_Guest,,The section that auto-generates addresses is glichy and it took ages to work out the right way to type my address so that an incorrect address wouldn't auto-populate.
"August 3, 2024",12:48:44 PM,CXp_Guest,,This is a very convenient way to renew your documents without traveling and standing in lines. I am glad ServiceOntario is providing services for people online now. Thank you!
"August 1, 2024",5:43:46 PM,CXp_Guest,,It's good
"August 1, 2024",8:26:42 AM,CXp_Guest,,"it's very good, love it!"
"August 1, 2024",5:08:26 PM,CXp_Guest,,N/A
"August 1, 2024",10:34:07 PM,CXp_Guest,,Perfect!
"July 31, 2024",6:16:22 PM,CXp_Guest,,Great service!
"July 30, 2024",10:12:15 AM,CXp_Guest,,"a list of documents needed for a child's healt card renewal on the front page would be helpful, but otherwise, all was great and easy to navigate."
"July 26, 2024",6:17:37 PM,CXp_Guest,,Too many pieces of information to fill in.  Is it necessary to fill out birth certificate number on a renewal?
"July 22, 2024",8:47:19 PM,CXp_Guest,,"The address search is very difficult to use, and takes a learning curve. A simpler algorithm would be good, or allowing a person to simply search their street and add their address in. Needing to select the block of houses on a street is odd, and the system defaults to wrong addresses to easily."
"July 20, 2024",9:16:10 AM,CXp_Guest,,automatic tab to next field box
"July 19, 2024",1:35:46 PM,CXp_Guest,,"The submission doesn't work at all. I tried it thrice, just to encounter the same error message on final submission."
"July 16, 2024",1:37:37 PM,CXp_Guest,,Thank you!
"July 13, 2024",11:29:12 AM,CXp_Guest,,Good service so far. Except I need photo id and my drivers has been suspended and I cannot apply for an Ontario photo card ????
"July 12, 2024",10:50:01 PM,CXp_Guest,,Nice and quick process. Would be nice to know if it's approved at the end.
"July 12, 2024",4:39:11 PM,CXp_Guest,,"System has been down for 2 days, why hasn't it been fixed yet?"
"July 12, 2024",5:45:29 PM,CXp_Guest,,"The address search function was bad. It was preloaded with an incorrect town, which made entering my actual address difficult."
"July 8, 2024",10:35:52 AM,CXp_Guest,,The website did not work on Firefox browser.
"July 5, 2024",8:40:06 AM,CXp_Guest,,"1.  my submission didn't go through for an unknown reason.  2. under the child's information part it asks for the number on the ""back of your card"" instead of the ""back of the child's card"".  This is confusing and I only realized it was for the child once I completed the part for the parent a few steps later."
"July 3, 2024",12:20:22 PM,CXp_Guest,,In my mail notification for there was no indication that I could complete this health card renewal online. This information would have been helpful at the receipt of my paper notification.
"July 2, 2024",11:20:12 AM,CXp_Guest,,I received a letter that did not give me an online option to renew but rather required that I mail in the renewal application form. I feel that I should have been given that option in the first place rather than have me seek it out myself.
"June 27, 2024",7:17:15 AM,CXp_Guest,,The service to renew our daughter's Health Card was very simple and easy to use. I'm not sure how we can improve upon on this unless there's a way to renew automatically without having to type in any info.
"June 25, 2024",5:23:12 PM,CXp_Account,,none
"June 25, 2024",3:08:06 PM,CXp_Guest,,i filled the forms twice only to be told that it has failed .
"June 25, 2024",1:15:28 PM,CXp_Guest,,"Seems good, keep up this service and keep such options available for Ontarians."
"June 22, 2024",1:02:18 PM,CXp_Guest,,The auto fill address option kept putting incorrect options and auto filling before I could continue. Also wouldn't allow me to put my correct postal code
"June 19, 2024",1:18:44 PM,CXp_Account,,test
"June 19, 2024",1:17:45 PM,CXp_Guest,,test
"June 6, 2024",10:09:09 AM,CXp_Guest,,Address section clicked on address and showed populated by address then down below had another city populated had to blank out auto fill and refill 3 x to get it to display properly for my child's health card renewal and when implemented same address for myself the requestor.  Was strange yet wanted to ensure it gets sent to my house.  If a person was clicking through fast would not get proper address autofilled go some other place.
"June 6, 2024",5:37:37 PM,CXp_Guest,,There was a glitch when entering my address. It kept automatically filling the field incorrectly so I had to redo it 3 times.
"June 5, 2024",11:52:35 PM,CXp_Guest,,"I had a hard time loading my address towards the end. For some reason, the online prompts could not locate my home address online automatically and kept giving me the wrong address. I had to update my address and change it to the same address. Once I did that I had to do the process of renewing my child's health card from the very beginning and eventually it found my home address the process took over 30 min."
,,,,
"Applied filters:
Improvement is not (Blank), , -, or —-
Included (1) Transactional (Trans/Info) + Child Health Card Renewal (App_Name)
Parameter is Quarterly
Parameter is Overall Satisfaction
Application & Service is not FBP",,,,
